,title,description,published date,url,publisher,score
1,"Pro-Palestine student organizers face crackdowns by universities, legal charges - Prism","Pro-Palestine student organizers face crackdowns by universities, legal charges  Prism","Tue, 05 Mar 2024 08:00:00 GMT",https://news.google.com/rss/articles/CBMiW2h0dHBzOi8vcHJpc21yZXBvcnRzLm9yZy8yMDI0LzAzLzA1L3Byby1wYWxlc3RpbmUtc3R1ZGVudC1vcmdhbml6ZXJzLXVuaXZlcnNpdHktY3JhY2tkb3ducy_SAQA?oc=5&hl=en-US&gl=US&ceid=US:en,"{'href': 'https://prismreports.org', 'title': 'Prism'}",3
4,"150 students take part in pro-Palestine, pro-Israel protests in Oklahoma Memorial Union - The Oklahoma Daily","150 students take part in pro-Palestine, pro-Israel protests in Oklahoma Memorial Union  The Oklahoma Daily","Fri, 08 Mar 2024 23:20:24 GMT",https://news.google.com/rss/articles/CBMipQFodHRwczovL3d3dy5vdWRhaWx5LmNvbS9uZXdzLzE1MC1zdHVkZW50cy10YWtlLXBhcnQtaW4tcHJvLXBhbGVzdGluZS1wcm8taXNyYWVsLXByb3Rlc3RzLWluLW9rbGFob21hLW1lbW9yaWFsLXVuaW9uL2FydGljbGVfZDY1NDJlNWEtZGNkNC0xMWVlLTg1NjEtMTMwYTc4ODVhMzMzLmh0bWzSAQA?oc=5&hl=en-US&gl=US&ceid=US:en,"{'href': 'https://www.oudaily.com', 'title': 'The Oklahoma Daily'}",3
6,Students protest Kumar’s condemnation of TCU Senate resolutions - Tufts Daily,Students protest Kumar’s condemnation of TCU Senate resolutions  Tufts Daily,"Wed, 06 Mar 2024 08:00:00 GMT",https://news.google.com/rss/articles/CBMiaWh0dHBzOi8vd3d3LnR1ZnRzZGFpbHkuY29tL2FydGljbGUvMjAyNC8wMy9zdHVkZW50cy1wcm90ZXN0LWt1bWFycy1jb25kZW1uYXRpb24tb2YtdGN1LXNlbmF0ZS1yZXNvbHV0aW9uc9IBAA?oc=5&hl=en-US&gl=US&ceid=US:en,"{'href': 'https://www.tuftsdaily.com', 'title': 'Tufts Daily'}",3
7,Amherst for Palestine Demands Divestment Outside Trustee Dinner - The Amherst Student,Amherst for Palestine Demands Divestment Outside Trustee Dinner  The Amherst Student,"Wed, 06 Mar 2024 08:00:00 GMT",https://news.google.com/rss/articles/CBMiY2h0dHBzOi8vYW1oZXJzdHN0dWRlbnQuY29tL2FydGljbGUvYW1oZXJzdC1mb3ItcGFsZXN0aW5lLWRlbWFuZHMtZGl2ZXN0bWVudC1vdXRzaWRlLXRydXN0ZWUtZGlubmVyL9IBZ2h0dHBzOi8vYW1oZXJzdHN0dWRlbnQuY29tL2FydGljbGUvYW1oZXJzdC1mb3ItcGFsZXN0aW5lLWRlbWFuZHMtZGl2ZXN0bWVudC1vdXRzaWRlLXRydXN0ZWUtZGlubmVyL2FtcC8?oc=5&hl=en-US&gl=US&ceid=US:en,"{'href': 'https://amherststudent.com', 'title': 'The Amherst Student'}",3
8,Columbia's protest policy less stringent than last iteration - Inside Higher Ed,Columbia's protest policy less stringent than last iteration  Inside Higher Ed,"Thu, 07 Mar 2024 08:00:00 GMT",https://news.google.com/rss/articles/CBMiemh0dHBzOi8vd3d3Lmluc2lkZWhpZ2hlcmVkLmNvbS9uZXdzL3N0dWRlbnRzL2ZyZWUtc3BlZWNoLzIwMjQvMDMvMDcvY29sdW1iaWFzLXByb3Rlc3QtcG9saWN5LWxlc3Mtc3RyaW5nZW50LWxhc3QtaXRlcmF0aW9u0gEA?oc=5&hl=en-US&gl=US&ceid=US:en,"{'href': 'https://www.insidehighered.com', 'title': 'Inside Higher Ed'}",3
12,Vanderbilt students protest for prison reform and Palestine in Alabama - The Vanderbilt Hustler,Vanderbilt students protest for prison reform and Palestine in Alabama  The Vanderbilt Hustler,"Mon, 04 Mar 2024 08:00:00 GMT",https://news.google.com/rss/articles/CBMicGh0dHBzOi8vdmFuZGVyYmlsdGh1c3RsZXIuY29tLzIwMjQvMDMvMDQvdmFuZGVyYmlsdC1zdHVkZW50cy1wcm90ZXN0LWZvci1wcmlzb24tcmVmb3JtLWFuZC1wYWxlc3RpbmUtaW4tYWxhYmFtYS_SAQA?oc=5&hl=en-US&gl=US&ceid=US:en,"{'href': 'https://vanderbilthustler.com', 'title': 'The Vanderbilt Hustler'}",3
13,UCSD students organize large protest in support of Palestine - ABC 10 News San Diego KGTV,UCSD students organize large protest in support of Palestine  ABC 10 News San Diego KGTV,"Wed, 06 Mar 2024 08:00:00 GMT",https://news.google.com/rss/articles/CBMiY2h0dHBzOi8vd3d3LjEwbmV3cy5jb20vbmV3cy9sb2NhbC1uZXdzL3Vjc2Qtc3R1ZGVudHMtb3JnYW5pemUtbGFyZ2UtcHJvdGVzdC1pbi1zdXBwb3J0LW9mLXBhbGVzdGluZdIBAA?oc=5&hl=en-US&gl=US&ceid=US:en,"{'href': 'https://www.10news.com', 'title': 'ABC 10 News San Diego KGTV'}",3
17,Student Protesters Accuse Harvard Administrators of Surveillance at Palestine Vigil | News - Harvard Crimson,Student Protesters Accuse Harvard Administrators of Surveillance at Palestine Vigil | News  Harvard Crimson,"Mon, 04 Mar 2024 08:00:00 GMT",https://news.google.com/rss/articles/CBMiU2h0dHBzOi8vd3d3LnRoZWNyaW1zb24uY29tL2FydGljbGUvMjAyNC8zLzQvcHJvdGVzdGVycy1hY2N1c2UtaGFydmFyZC1zdXJ2ZWlsbGFuY2Uv0gEA?oc=5&hl=en-US&gl=US&ceid=US:en,"{'href': 'https://www.thecrimson.com', 'title': 'Harvard Crimson'}",3
18,"Ithaca Common Council calls for ceasefire in Israel, Hamas war. Cornell students continue to protest - WSKG.org","Ithaca Common Council calls for ceasefire in Israel, Hamas war. Cornell students continue to protest  WSKG.org","Thu, 07 Mar 2024 08:00:00 GMT",https://news.google.com/rss/articles/CBMihwFodHRwczovL3d3dy53c2tnLm9yZy9uZXdzLzIwMjQtMDMtMDcvaXRoYWNhLWNvbW1vbi1jb3VuY2lsLWNhbGxzLWZvci1jZWFzZWZpcmUtaW4taXNyYWVsLWhhbWFzLXdhci1jb3JuZWxsLXN0dWRlbnRzLWNvbnRpbnVlLXRvLXByb3Rlc3TSAQA?oc=5&hl=en-US&gl=US&ceid=US:en,"{'href': 'https://www.wskg.org', 'title': 'WSKG.org'}",3
20,Students allege police aggression at Nov. 17 protest for Palestine - Tufts Daily,Students allege police aggression at Nov. 17 protest for Palestine  Tufts Daily,"Thu, 07 Mar 2024 08:00:00 GMT",https://news.google.com/rss/articles/CBMibGh0dHBzOi8vd3d3LnR1ZnRzZGFpbHkuY29tL2FydGljbGUvMjAyNC8wMy9zdHVkZW50cy1hbGxlZ2UtcG9saWNlLWFnZ3Jlc3Npb24tYXQtbm92LTE3LXByb3Rlc3QtZm9yLXBhbGVzdGluZdIBAA?oc=5&hl=en-US&gl=US&ceid=US:en,"{'href': 'https://www.tuftsdaily.com', 'title': 'Tufts Daily'}",3
21,Protesters Disrupt Event With Israeli Soldier on New School Campus - Hyperallergic,Protesters Disrupt Event With Israeli Soldier on New School Campus  Hyperallergic,"Thu, 07 Mar 2024 08:00:00 GMT",https://news.google.com/rss/articles/CBMiZGh0dHBzOi8vaHlwZXJhbGxlcmdpYy5jb20vODc2NDAzL3Byb3Rlc3RlcnMtZGlzcnVwdC1ldmVudC13aXRoLWlzcmFlbGktc29sZGllci1vbi1uZXctc2Nob29sLWNhbXB1cy_SAQA?oc=5&hl=en-US&gl=US&ceid=US:en,"{'href': 'https://hyperallergic.com', 'title': 'Hyperallergic'}",3
23,Statement from President Rivera Regarding Mac for Palestine Protest - Macalester College,Statement from President Rivera Regarding Mac for Palestine Protest  Macalester College,"Wed, 06 Mar 2024 08:00:00 GMT",https://news.google.com/rss/articles/CBMiZ2h0dHBzOi8vd3d3Lm1hY2FsZXN0ZXIuZWR1L3ByZXNpZGVudC9tZXNzYWdlcy8yMDI0LTAzLTA2LXN0YXRlbWVudC1yZWdhcmRpbmctbWFjLWZvci1wYWxlc3RpbmUtcHJvdGVzdC_SAQA?oc=5&hl=en-US&gl=US&ceid=US:en,"{'href': 'https://www.macalester.edu', 'title': 'Macalester College'}",3
24,UC San Diego to boost security ahead of pro-Palestinian demonstrations over Gaza war - The San Diego Union-Tribune,UC San Diego to boost security ahead of pro-Palestinian demonstrations over Gaza war  The San Diego Union-Tribune,"Tue, 05 Mar 2024 08:00:00 GMT",https://news.google.com/rss/articles/CBMirQFodHRwczovL3d3dy5zYW5kaWVnb3VuaW9udHJpYnVuZS5jb20vbmV3cy9lZHVjYXRpb24vc3RvcnkvMjAyNC0wMy0wNS91Yy1zYW4tZGllZ28tb2ZmZXJzLXNhZmV0eS1lc2NvcnRzLXRvLXBlb3BsZS13aG9sbC1iZS1pbi1hcmVhLW9mLXByby1wYWxlc3RpbmUtcmFsbHktb24tY2FtcHVzLXdlZG5lc2RhedIBAA?oc=5&hl=en-US&gl=US&ceid=US:en,"{'href': 'https://www.sandiegouniontribune.com', 'title': 'The San Diego Union-Tribune'}",3
25,Palestine Library Sit-In Faces Administrative Pushback - The Catalyst,Palestine Library Sit-In Faces Administrative Pushback  The Catalyst,"Thu, 07 Mar 2024 08:00:00 GMT",https://news.google.com/rss/articles/CBMiXmh0dHBzOi8vdGhlY2F0YWx5c3RuZXdzLmNvbS8yMDI0LzAzLzA3L3BhbGVzdGluZS1saWJyYXJ5LXNpdC1pbi1mYWNlcy1hZG1pbmlzdHJhdGl2ZS1wdXNoYmFjay_SAWJodHRwczovL3RoZWNhdGFseXN0bmV3cy5jb20vMjAyNC8wMy8wNy9wYWxlc3RpbmUtbGlicmFyeS1zaXQtaW4tZmFjZXMtYWRtaW5pc3RyYXRpdmUtcHVzaGJhY2svYW1wLw?oc=5&hl=en-US&gl=US&ceid=US:en,"{'href': 'https://thecatalystnews.com', 'title': 'The Catalyst'}",3
26,USG cabinet meeting interrupted by pro-Palestine protesters demanding Issue 29 be put back on the ballot - OSU - The Lantern,USG cabinet meeting interrupted by pro-Palestine protesters demanding Issue 29 be put back on the ballot  OSU - The Lantern,"Wed, 06 Mar 2024 08:00:00 GMT",https://news.google.com/rss/articles/CBMijAFodHRwczovL3d3dy50aGVsYW50ZXJuLmNvbS8yMDI0LzAzL3VzZy1jYWJpbmV0LW1lZXRpbmctaW50ZXJydXB0ZWQtYnktcHJvLXBhbGVzdGluZS1wcm90ZXN0ZXJzLWRlbWFuZGluZy1pc3N1ZS0yOS1iZS1wdXQtYmFjay1vbi10aGUtYmFsbG90L9IBAA?oc=5&hl=en-US&gl=US&ceid=US:en,"{'href': 'https://www.thelantern.com', 'title': 'OSU - The Lantern'}",3
29,Dozens of people on University of Arkansas campus protest war in Gaza | Arkansas Democrat Gazette - Arkansas Online,Dozens of people on University of Arkansas campus protest war in Gaza | Arkansas Democrat Gazette  Arkansas Online,"Sat, 09 Mar 2024 08:00:00 GMT",https://news.google.com/rss/articles/CBMiYmh0dHBzOi8vd3d3LmFya2Fuc2Fzb25saW5lLmNvbS9uZXdzLzIwMjQvbWFyLzA5L2RvemVucy1vZi1wZW9wbGUtb24tdW5pdmVyc2l0eS1vZi1hcmthbnNhcy1jYW1wdXMv0gEA?oc=5&hl=en-US&gl=US&ceid=US:en,"{'href': 'https://www.arkansasonline.com', 'title': 'Arkansas Online'}",3
31,SJP protests IDF soliders at Hillel Shabbat - PantherNOW,SJP protests IDF soliders at Hillel Shabbat  PantherNOW,"Sat, 09 Mar 2024 08:00:00 GMT",https://news.google.com/rss/articles/CBMiO2h0dHBzOi8vcGFudGhlcm5vdy5jb20vMjAyNC8wMy8wOS9pc3JhZWxpLXNvbGRpZXJzLXByb3Rlc3Qv0gEA?oc=5&hl=en-US&gl=US&ceid=US:en,"{'href': 'https://panthernow.com', 'title': 'PantherNOW'}",3
32,"Pro-Israel groups display Israeli flags commemorating Oct. 7 deaths, pro-Palestinian students stage protest - Duke Chronicle","Pro-Israel groups display Israeli flags commemorating Oct. 7 deaths, pro-Palestinian students stage protest  Duke Chronicle","Mon, 04 Mar 2024 08:00:00 GMT",https://news.google.com/rss/articles/CBMiygFodHRwczovL3d3dy5kdWtlY2hyb25pY2xlLmNvbS9hcnRpY2xlLzIwMjQvMDMvZHVrZS11bml2ZXJzaXR5LXByby1pc3JhZWwtZ3JvdXBzLWRpc3BsYXktaXNyYWVsaS1mbGFncy1jb21tZW1vcmF0aW5nLW9jdC03LWRlYXRocy1wcm8tcGFsZXN0aW5pYW4tc3R1ZGVudHMtc3RhZ2UtcmVzcG9uc2Utc3NpLWNvdW50ZXItcHJvdGVzdC1kZW1vbnN0cmF0aW9u0gEA?oc=5&hl=en-US&gl=US&ceid=US:en,"{'href': 'https://www.dukechronicle.com', 'title': 'Duke Chronicle'}",3
36,UC San Diego student government group calls on school to divest from Israel - KPBS,UC San Diego student government group calls on school to divest from Israel  KPBS,"Thu, 07 Mar 2024 08:00:00 GMT",https://news.google.com/rss/articles/CBMijQFodHRwczovL3d3dy5rcGJzLm9yZy9uZXdzL3JhY2lhbC1qdXN0aWNlLXNvY2lhbC1lcXVpdHkvMjAyNC8wMy8wNy91Yy1zYW4tZGllZ28tc3R1ZGVudC1nb3Zlcm5tZW50LWdyb3VwLWNhbGxzLW9uLXNjaG9vbC10by1kaXZlc3QtZnJvbS1pc3JhZWzSAQA?oc=5&hl=en-US&gl=US&ceid=US:en,"{'href': 'https://www.kpbs.org', 'title': 'KPBS'}",3
39,UK students occupy university building in protest for Palestine - Al Jazeera English,UK students occupy university building in protest for Palestine  Al Jazeera English,"Fri, 08 Mar 2024 08:00:00 GMT",https://news.google.com/rss/articles/CBMiemh0dHBzOi8vd3d3LmFsamF6ZWVyYS5jb20vcHJvZ3JhbS9uZXdzZmVlZC8yMDI0LzMvOC91ay11bml2ZXJzaXR5LXN0dWRlbnRzLW9jY3VweS1jYW1wdXMtYnVpbGRpbmctaW4tcHJvdGVzdC1mb3ItcGFsZXN0aW5l0gF-aHR0cHM6Ly93d3cuYWxqYXplZXJhLmNvbS9hbXAvcHJvZ3JhbS9uZXdzZmVlZC8yMDI0LzMvOC91ay11bml2ZXJzaXR5LXN0dWRlbnRzLW9jY3VweS1jYW1wdXMtYnVpbGRpbmctaW4tcHJvdGVzdC1mb3ItcGFsZXN0aW5l?oc=5&hl=en-US&gl=US&ceid=US:en,"{'href': 'https://www.aljazeera.com', 'title': 'Al Jazeera English'}",3
42,"Pro-Palestine, pro-Israel protests to take place in Oklahoma Memorial Union - The Oklahoma Daily","Pro-Palestine, pro-Israel protests to take place in Oklahoma Memorial Union  The Oklahoma Daily","Fri, 08 Mar 2024 08:00:00 GMT",https://news.google.com/rss/articles/CBMimQFodHRwczovL3d3dy5vdWRhaWx5LmNvbS9uZXdzL3Byby1wYWxlc3RpbmUtcHJvLWlzcmFlbC1wcm90ZXN0cy10by10YWtlLXBsYWNlLWluLW9rbGFob21hLW1lbW9yaWFsLXVuaW9uL2FydGljbGVfYzIyN2Y4OTYtZGM5MS0xMWVlLWJkM2UtYWI4NGM4MjgyYWY5Lmh0bWzSAQA?oc=5&hl=en-US&gl=US&ceid=US:en,"{'href': 'https://www.oudaily.com', 'title': 'The Oklahoma Daily'}",3
43,Cancellation of Gaza relief event draws protests at Montclair State - NorthJersey.com,Cancellation of Gaza relief event draws protests at Montclair State  NorthJersey.com,"Fri, 08 Mar 2024 08:00:00 GMT",https://news.google.com/rss/articles/CBMihAFodHRwczovL3d3dy5ub3J0aGplcnNleS5jb20vc3RvcnkvbmV3cy8yMDI0LzAzLzA4L2NhbmNlbGxhdGlvbi1vZi1nYXphLXJlbGllZi1ldmVudC10by1kcmF3LXByb3Rlc3RzLWF0LW1vbnRjbGFpci1zdGF0ZS83Mjg5ODU5NjAwNy_SAQA?oc=5&hl=en-US&gl=US&ceid=US:en,"{'href': 'https://www.northjersey.com', 'title': 'NorthJersey.com'}",3
45,Thousands demand Gaza war end in UCSD protest for Palestine - The San Diego Union-Tribune,Thousands demand Gaza war end in UCSD protest for Palestine  The San Diego Union-Tribune,"Wed, 06 Mar 2024 08:00:00 GMT",https://news.google.com/rss/articles/CBMiuAFodHRwczovL3d3dy5zYW5kaWVnb3VuaW9udHJpYnVuZS5jb20vbmV3cy9lZHVjYXRpb24vc3RvcnkvMjAyNC0wMy0wNi90aG91c2FuZHMtb2YtcHJvLXBhbGVzdGluaWFuLWRlbW9uc3RyYXRvcnMtZGVtYW5kLWVuZC10by13YXItaW4tZ2F6YS1pbi1vbmUtb2YtdGhlLWxhcmdlc3QtcHJvdGVzdHMtaW4tdWNzZC1oaXN0b3J50gEA?oc=5&hl=en-US&gl=US&ceid=US:en,"{'href': 'https://www.sandiegouniontribune.com', 'title': 'The San Diego Union-Tribune'}",3
47,UC Berkeley students and faculty reject university condemnation of protest of anti-Palestinian speaker - Mondoweiss,UC Berkeley students and faculty reject university condemnation of protest of anti-Palestinian speaker  Mondoweiss,"Sun, 10 Mar 2024 08:00:00 GMT",https://news.google.com/rss/articles/CBMiigFodHRwczovL21vbmRvd2Vpc3MubmV0LzIwMjQvMDMvdWMtYmVya2VsZXktc3R1ZGVudHMtYW5kLWZhY3VsdHktcmVzcG9uZC10by11bml2ZXJzaXR5LWNvbmRlbW5hdGlvbi1vZi1wcm90ZXN0LW9mLWFudGktcGFsZXN0aW5pYW4tc3BlYWtlci_SAQA?oc=5&hl=en-US&gl=US&ceid=US:en,"{'href': 'https://mondoweiss.net', 'title': 'Mondoweiss'}",3
55,Rep. Josh Gottheimer Goes to War Against High Schoolers Protesting for Gaza - The Intercept,Rep. Josh Gottheimer Goes to War Against High Schoolers Protesting for Gaza  The Intercept,"Wed, 06 Mar 2024 08:00:00 GMT",https://news.google.com/rss/articles/CBMiV2h0dHBzOi8vdGhlaW50ZXJjZXB0LmNvbS8yMDI0LzAzLzA2L25qLWpvc2gtZ290dGhlaW1lci1oaWdoLXNjaG9vbC1wcm90ZXN0LWdhemEtaXNyYWVsL9IBAA?oc=5&hl=en-US&gl=US&ceid=US:en,"{'href': 'https://theintercept.com', 'title': 'The Intercept'}",3
56,UB protest demands divestment from companies 'complicit in human rights abuse in Palestine' - University at Buffalo The Spectrum,UB protest demands divestment from companies 'complicit in human rights abuse in Palestine'  University at Buffalo The Spectrum,"Wed, 06 Mar 2024 08:00:00 GMT",https://news.google.com/rss/articles/CBMiZ2h0dHBzOi8vd3d3LnVic3BlY3RydW0uY29tL2FydGljbGUvMjAyNC8wMy91bml2ZXJzaXR5LWF0LWJ1ZmZhbG8tZGl2ZXN0bWVudC1wcm90ZXN0LXBhbGVzdGluZS1jb21wbGljaXTSAQA?oc=5&hl=en-US&gl=US&ceid=US:en,"{'href': 'https://www.ubspectrum.com', 'title': 'University at Buffalo The Spectrum'}",3
57,"Large Pro-Palestinian Protest at UCSD Mostly Peaceful, But One Incident of Violence Reported - Times of San Diego","Large Pro-Palestinian Protest at UCSD Mostly Peaceful, But One Incident of Violence Reported  Times of San Diego","Thu, 07 Mar 2024 08:00:00 GMT",https://news.google.com/rss/articles/CBMijQFodHRwczovL3RpbWVzb2ZzYW5kaWVnby5jb20vZWR1Y2F0aW9uLzIwMjQvMDMvMDcvbGFyZ2UtcHJvLXBhbGVzdGluaWFuLXByb3Rlc3QtYXQtdWNzZC1tb3N0bHktcGVhY2VmdWwtYnV0LW9uZS1pbmNpZGVudC1vZi12aW9sZW5jZS1yZXBvcnRlZC_SAQA?oc=5&hl=en-US&gl=US&ceid=US:en,"{'href': 'https://timesofsandiego.com', 'title': 'Times of San Diego'}",3
68,Pro-Palestinian students protest Warnock during church sermon | Politics News - The Christian Post,Pro-Palestinian students protest Warnock during church sermon | Politics News  The Christian Post,"Mon, 04 Mar 2024 08:00:00 GMT",https://news.google.com/rss/articles/CBMiZWh0dHBzOi8vd3d3LmNocmlzdGlhbnBvc3QuY29tL25ld3MvcHJvLXBhbGVzdGluaWFuLXN0dWRlbnRzLXByb3Rlc3Qtd2Fybm9jay1kdXJpbmctY2h1cmNoLXNlcm1vbi5odG1s0gEA?oc=5&hl=en-US&gl=US&ceid=US:en,"{'href': 'https://www.christianpost.com', 'title': 'The Christian Post'}",3
72,Cambridge students organise protest against Trinity College's ties to Israel - The Tab,Cambridge students organise protest against Trinity College's ties to Israel  The Tab,"Wed, 06 Mar 2024 08:00:00 GMT",https://news.google.com/rss/articles/CBMifWh0dHBzOi8vdGhldGFiLmNvbS91ay9jYW1icmlkZ2UvMjAyNC8wMy8wNi9jYW1icmlkZ2Utc3R1ZGVudHMtb3JnYW5pc2UtcHJvdGVzdC1hZ2FpbnN0LXRyaW5pdHktY29sbGVnZXMtdGllcy10by1pc3JhZWwtMTc1NDg40gEA?oc=5&hl=en-US&gl=US&ceid=US:en,"{'href': 'https://thetab.com', 'title': 'The Tab'}",3
76,Exclusive: Bristol students camp overnight in Victoria Rooms in pro-Palestine protest - The Tab,Exclusive: Bristol students camp overnight in Victoria Rooms in pro-Palestine protest  The Tab,"Sat, 09 Mar 2024 08:00:00 GMT",https://news.google.com/rss/articles/CBMif2h0dHBzOi8vdGhldGFiLmNvbS91ay9icmlzdG9sLzIwMjQvMDMvMDkvZXhjbHVzaXZlLXN0dWRlbnRzLWNhbXAtb3Zlcm5pZ2h0LWluLXRoZS12aWN0b3JpYS1yb29tcy1pbi1wcm8tcGFsZXN0aW5lLXByb3Rlc3QtNTk3MjnSAQA?oc=5&hl=en-US&gl=US&ceid=US:en,"{'href': 'https://thetab.com', 'title': 'The Tab'}",3
78,Leeds students occupying Parkinson building claim the university rescinded its offer to meet - The Tab,Leeds students occupying Parkinson building claim the university rescinded its offer to meet  The Tab,"Fri, 08 Mar 2024 08:00:00 GMT",https://news.google.com/rss/articles/CBMiiQFodHRwczovL3RoZXRhYi5jb20vdWsvbGVlZHMvMjAyNC8wMy8wOC9sZWVkcy1zdHVkZW50cy1vY2N1cHlpbmctcGFya2luc29uLWJ1aWxkaW5nLWNsYWltLXRoZS11bml2ZXJzaXR5LXJlc2NpbmRlZC1pdHMtb2ZmZXItdG8tbWVldC01OTI1MdIBAA?oc=5&hl=en-US&gl=US&ceid=US:en,"{'href': 'https://thetab.com', 'title': 'The Tab'}",3
82,Leeds students occupying Parkinson Court demand meeting with uni in protest for Palestine - The Tab,Leeds students occupying Parkinson Court demand meeting with uni in protest for Palestine  The Tab,"Thu, 07 Mar 2024 08:00:00 GMT",https://news.google.com/rss/articles/CBMihgFodHRwczovL3RoZXRhYi5jb20vdWsvbGVlZHMvMjAyNC8wMy8wNy9sZWVkcy1zdHVkZW50cy1vY2N1cHlpbmctcGFya2luc29uLWNvdXJ0LWluLXByb3Rlc3QtZm9yLXBhbGVzdGluZS1kZW1hbmQtbWVldGluZy13aXRoLXVuaS01OTIzMtIBAA?oc=5&hl=en-US&gl=US&ceid=US:en,"{'href': 'https://thetab.com', 'title': 'The Tab'}",3
83,Jewish students are left feeling 'absolutely broken' after being mobbed by 100 pro-Palestine protesters who 's - Daily Mail,Jewish students are left feeling 'absolutely broken' after being mobbed by 100 pro-Palestine protesters who 's  Daily Mail,"Wed, 06 Mar 2024 08:00:00 GMT",https://news.google.com/rss/articles/CBMisQFodHRwczovL3d3dy5kYWlseW1haWwuY28udWsvbmV3cy9hcnRpY2xlLTEzMTY1NjYxL0pld2lzaC1zdHVkZW50cy1sZWZ0LWZlZWxpbmctYWJzb2x1dGVseS1icm9rZW4tbW9iYmVkLTEwMC1wcm8tUGFsZXN0aW5lLXByb3Rlc3RlcnMtc2NyZWFtZWQtZmFjZXMtdGhyZXctb3JhbmdlLXNxdWFzaC10aGVtLmh0bWzSAbUBaHR0cHM6Ly93d3cuZGFpbHltYWlsLmNvLnVrL25ld3MvYXJ0aWNsZS0xMzE2NTY2MS9hbXAvSmV3aXNoLXN0dWRlbnRzLWxlZnQtZmVlbGluZy1hYnNvbHV0ZWx5LWJyb2tlbi1tb2JiZWQtMTAwLXByby1QYWxlc3RpbmUtcHJvdGVzdGVycy1zY3JlYW1lZC1mYWNlcy10aHJldy1vcmFuZ2Utc3F1YXNoLXRoZW0uaHRtbA?oc=5&hl=en-US&gl=US&ceid=US:en,"{'href': 'https://www.dailymail.co.uk', 'title': 'Daily Mail'}",3
87,Students stage die-in protest for Israeli Apartheid Week - Queen's Journal,Students stage die-in protest for Israeli Apartheid Week  Queen's Journal,"Fri, 08 Mar 2024 08:00:00 GMT",https://news.google.com/rss/articles/CBMiVmh0dHBzOi8vd3d3LnF1ZWVuc2pvdXJuYWwuY2Evc3R1ZGVudHMtc3RhZ2UtZGllLWluLXByb3Rlc3QtZm9yLWlzcmFlbGktYXBhcnRoZWlkLXdlZWsv0gEA?oc=5&hl=en-US&gl=US&ceid=US:en,"{'href': 'https://www.queensjournal.ca', 'title': ""Queen's Journal""}",3
89,Students and Staff Protest Moulsecoomb Weapons Factory – The Badger - The Badger,Students and Staff Protest Moulsecoomb Weapons Factory – The Badger  The Badger,"Fri, 08 Mar 2024 08:00:00 GMT",https://news.google.com/rss/articles/CBMiW2h0dHBzOi8vdGhlYmFkZ2Vyb25saW5lLmNvbS8yMDI0LzAzL3N0dWRlbnRzLWFuZC1zdGFmZi1wcm90ZXN0LW1vdWxzZWNvb21iLXdlYXBvbnMtZmFjdG9yeS_SAQA?oc=5&hl=en-US&gl=US&ceid=US:en,"{'href': 'https://thebadgeronline.com', 'title': 'The Badger'}",3
90,"Expected Protest Congregating at Education Centre – Friday, March 8 | Hamilton-Wentworth District School Board - Hamilton-Wentworth District School Board","Expected Protest Congregating at Education Centre – Friday, March 8 | Hamilton-Wentworth District School Board  Hamilton-Wentworth District School Board","Thu, 07 Mar 2024 08:00:00 GMT",https://news.google.com/rss/articles/CBMiXmh0dHBzOi8vd3d3Lmh3ZHNiLm9uLmNhL2Jsb2cvZXhwZWN0ZWQtcHJvdGVzdC1jb25ncmVnYXRpbmctYXQtZWR1Y2F0aW9uLWNlbnRyZS1mcmlkYXktbWFyY2gtOC_SAQA?oc=5&hl=en-US&gl=US&ceid=US:en,"{'href': 'https://www.hwdsb.on.ca', 'title': 'Hamilton-Wentworth District School Board'}",3
94,Student-led protests continue amidst UCD’s ongoing refusal to take a firm stance on Gaza - University Observer Online,Student-led protests continue amidst UCD’s ongoing refusal to take a firm stance on Gaza  University Observer Online,"Fri, 08 Mar 2024 08:00:00 GMT",https://news.google.com/rss/articles/CBMicmh0dHBzOi8vdW5pdmVyc2l0eW9ic2VydmVyLmllL3N0dWRlbnQtcHJvdGVzdHMtY29udGludWUtYW1pZHN0LXVjZHMtb25nb2luZy1yZWZ1c2FsLXRvLXRha2UtYS1maXJtLXN0YW5jZS1vbi1nYXphL9IBAA?oc=5&hl=en-US&gl=US&ceid=US:en,"{'href': 'https://universityobserver.ie', 'title': 'University Observer Online'}",3
99,"After more than two weeks, students occupying Goldsmiths building over Palestine conflict are in it for the long haul ... - EastLondonLines","After more than two weeks, students occupying Goldsmiths building over Palestine conflict are in it for the long haul ...  EastLondonLines","Fri, 08 Mar 2024 08:00:00 GMT",https://news.google.com/rss/articles/CBMinwFodHRwczovL3d3dy5lYXN0bG9uZG9ubGluZXMuY28udWsvMjAyNC8wMy9hZnRlci1tb3JlLXRoYW4tdHdvLXdlZWtzLXN0dWRlbnRzLW9jY3VweWluZy1nb2xkc21pdGhzLWJ1aWxkaW5nLW92ZXItcGFsZXN0aW5lLWNvbmZsaWN0LWFyZS1pbi1pdC1mb3ItdGhlLWxvbmctaGF1bC_SAQA?oc=5&hl=en-US&gl=US&ceid=US:en,"{'href': 'https://www.eastlondonlines.co.uk', 'title': 'EastLondonLines'}",3
8,Editorial: Dartmouth's puzzling prosecution of protesters - Valley News,Editorial: Dartmouth's puzzling prosecution of protesters  Valley News,"Fri, 15 Mar 2024 07:00:00 GMT",https://news.google.com/rss/articles/CBMibGh0dHBzOi8vd3d3LnZuZXdzLmNvbS9FZGl0b3JpYWwtV2h5LWlzLURhcnRtb3V0aC1zby1pbnRlbnQtb24tcHJvc2VjdXRpbmctdHdvLW5vbnZpb2xlbnQtcHJvdGVzdGVycy01NDQwNDMzNtIBAA?oc=5&hl=en-US&gl=US&ceid=US:en,"{'href': 'https://www.vnews.com', 'title': 'Valley News'}",3
9,Pro-Palestinian protesters shut down event organized by Pro-Israel student groups at UC Berkeley - Los Angeles Times,Pro-Palestinian protesters shut down event organized by Pro-Israel student groups at UC Berkeley  Los Angeles Times,"Tue, 12 Mar 2024 07:00:00 GMT",https://news.google.com/rss/articles/CBMiigFodHRwczovL3d3dy5sYXRpbWVzLmNvbS9jYWxpZm9ybmlhL3N0b3J5LzIwMjQtMDItMjcvcHJvLXBhbGVzdGluaWFuLXByb3Rlc3RlcnMtc2h1dC1kb3duLWV2ZW50LW9yZ2FuaXplZC1ieS1qZXdpc2gtc3R1ZGVudHMtYXQtdWMtYmVya2VsZXnSAQA?oc=5&hl=en-US&gl=US&ceid=US:en,"{'href': 'https://www.latimes.com', 'title': 'Los Angeles Times'}",3
10,Students protest at Hebrew University of Jerusalem after the suspension of a Palestinian professor - Middle East Monitor,Students protest at Hebrew University of Jerusalem after the suspension of a Palestinian professor  Middle East Monitor,"Sat, 16 Mar 2024 07:00:00 GMT",https://news.google.com/rss/articles/CBMijgFodHRwczovL3d3dy5taWRkbGVlYXN0bW9uaXRvci5jb20vMjAyNDAzMTYtc3R1ZGVudHMtcHJvdGVzdC1hdC1oZWJyZXctdW5pdmVyc2l0eS1vZi1qZXJ1c2FsZW0tYWZ0ZXItdGhlLXN1c3BlbnNpb24tb2YtYS1wYWxlc3Rpbmlhbi1wcm9mZXNzb3Iv0gGSAWh0dHBzOi8vd3d3Lm1pZGRsZWVhc3Rtb25pdG9yLmNvbS8yMDI0MDMxNi1zdHVkZW50cy1wcm90ZXN0LWF0LWhlYnJldy11bml2ZXJzaXR5LW9mLWplcnVzYWxlbS1hZnRlci10aGUtc3VzcGVuc2lvbi1vZi1hLXBhbGVzdGluaWFuLXByb2Zlc3Nvci9hbXAv?oc=5&hl=en-US&gl=US&ceid=US:en,"{'href': 'https://www.middleeastmonitor.com', 'title': 'Middle East Monitor'}",3
11,Australian students strike again to protest Israel's genocide in Gaza - WSWS,Australian students strike again to protest Israel's genocide in Gaza  WSWS,"Fri, 15 Mar 2024 07:00:00 GMT",https://news.google.com/rss/articles/CBMiOWh0dHBzOi8vd3d3Lndzd3Mub3JnL2VuL2FydGljbGVzLzIwMjQvMDMvMTYvbHRvdy1tMTYuaHRtbNIBAA?oc=5&hl=en-US&gl=US&ceid=US:en,"{'href': 'https://www.wsws.org', 'title': 'WSWS'}",3
12,Tensions Rise at UC Santa Barbara as Faculty and Students Protest for Gaza - Santa Barbara Independent,Tensions Rise at UC Santa Barbara as Faculty and Students Protest for Gaza  Santa Barbara Independent,"Thu, 14 Mar 2024 07:00:00 GMT",https://news.google.com/rss/articles/CBMicmh0dHBzOi8vd3d3LmluZGVwZW5kZW50LmNvbS8yMDI0LzAzLzE0L3RlbnNpb25zLXJpc2UtYXQtdWMtc2FudGEtYmFyYmFyYS1hcy1mYWN1bHR5LWFuZC1zdHVkZW50cy1wcm90ZXN0LWZvci1nYXphL9IBeGh0dHBzOi8vd3d3LmluZGVwZW5kZW50LmNvbS8yMDI0LzAzLzE0L3RlbnNpb25zLXJpc2UtYXQtdWMtc2FudGEtYmFyYmFyYS1hcy1mYWN1bHR5LWFuZC1zdHVkZW50cy1wcm90ZXN0LWZvci1nYXphLz9hbXA9MQ?oc=5&hl=en-US&gl=US&ceid=US:en,"{'href': 'https://www.independent.com', 'title': 'Santa Barbara Independent'}",3
17,"Tulane University pro-Palestine students protest New Orleans Bookfest, one arrested - Fight Back! Newspaper","Tulane University pro-Palestine students protest New Orleans Bookfest, one arrested  Fight Back! Newspaper","Sun, 17 Mar 2024 07:00:00 GMT",https://news.google.com/rss/articles/CBMibGh0dHBzOi8vZmlnaHRiYWNrbmV3cy5vcmcvYXJ0aWNsZXMvdHVsYW5lLXVuaXZlcnNpdHktcHJvLXBhbGVzdGluZS1zdHVkZW50cy1wcm90ZXN0LW5ldy1vcmxlYW5zLWJvb2tmZXN0LW9uZdIBAA?oc=5&hl=en-US&gl=US&ceid=US:en,"{'href': 'https://fightbacknews.org', 'title': 'Fight Back! Newspaper'}",3
18,Columbia sued over school's decision to suspend 2 pro-Palestinian groups - NBC News,Columbia sued over school's decision to suspend 2 pro-Palestinian groups  NBC News,"Tue, 12 Mar 2024 07:00:00 GMT",https://news.google.com/rss/articles/CBMia2h0dHBzOi8vd3d3Lm5iY25ld3MuY29tL25ld3MvdXMtbmV3cy9jb2x1bWJpYS1zdWVkLXNjaG9vbHMtZGVjaXNpb24tc3VzcGVuZC0yLXBhbGVzdGluaWFuLWdyb3Vwcy1yY25hMTQzMDcw0gEraHR0cHM6Ly93d3cubmJjbmV3cy5jb20vbmV3cy9hbXAvcmNuYTE0MzA3MA?oc=5&hl=en-US&gl=US&ceid=US:en,"{'href': 'https://www.nbcnews.com', 'title': 'NBC News'}",3
