,title,description,published date,url,publisher,score
77,University of Oregon students set up encampment to protest Gaza conflict - Oregon Public Broadcasting,University of Oregon students set up encampment to protest Gaza conflict  Oregon Public Broadcasting,"Tue, 30 Apr 2024 07:00:00 GMT",https://news.google.com/rss/articles/CBMicGh0dHBzOi8vd3d3Lm9wYi5vcmcvYXJ0aWNsZS8yMDI0LzA0LzMwL3VuaXZlcnNpdHktb2Ytb3JlZ29uLXN0dWRlbnRzLXNldC11cC1lbmNhbXBtZW50LXRvLXByb3Rlc3QtZ2F6YS1jb25mbGljdC_SAX9odHRwczovL3d3dy5vcGIub3JnL2FydGljbGUvMjAyNC8wNC8zMC91bml2ZXJzaXR5LW9mLW9yZWdvbi1zdHVkZW50cy1zZXQtdXAtZW5jYW1wbWVudC10by1wcm90ZXN0LWdhemEtY29uZmxpY3QvP291dHB1dFR5cGU9YW1w?oc=5&hl=en-US&gl=US&ceid=US:en,"{'href': 'https://www.opb.org', 'title': 'Oregon Public Broadcasting'}",3
78,Why are college students protesting? Explaining Israel-Gaza protests - NorthJersey.com,Why are college students protesting? Explaining Israel-Gaza protests  NorthJersey.com,"Tue, 30 Apr 2024 07:00:00 GMT",https://news.google.com/rss/articles/CBMifmh0dHBzOi8vd3d3Lm5vcnRoamVyc2V5LmNvbS9zdG9yeS9uZXdzLzIwMjQvMDUvMDEvd2h5LWFyZS1jb2xsZWdlLXN0dWRlbnRzLXByb3Rlc3RpbmctaXNyYWVsLWdhemEtaGFtYXMtZXhwbGFpbmVyLzczNTMwOTYzMDA3L9IBAA?oc=5&hl=en-US&gl=US&ceid=US:en,"{'href': 'https://www.northjersey.com', 'title': 'NorthJersey.com'}",3
79,"Student protest amidst war in Gaza, former Obama White House social secretary Deesha Dyer, cocktail brothers - WHYY","Student protest amidst war in Gaza, former Obama White House social secretary Deesha Dyer, cocktail brothers  WHYY","Tue, 30 Apr 2024 07:00:00 GMT",https://news.google.com/rss/articles/CBMib2h0dHBzOi8vd2h5eS5vcmcvZXBpc29kZXMvdW5pdmVyc2l0eS1wZW5uc3lsdmFuaWEtZ2F6YS1pc3JhZWwtaGFtYS13YXItb2JhbWEtd2hpdGUtaG91c2UtZGVlc2hhLWR5ZXItY29ja3RhaWxzL9IBc2h0dHBzOi8vd2h5eS5vcmcvZXBpc29kZXMvdW5pdmVyc2l0eS1wZW5uc3lsdmFuaWEtZ2F6YS1pc3JhZWwtaGFtYS13YXItb2JhbWEtd2hpdGUtaG91c2UtZGVlc2hhLWR5ZXItY29ja3RhaWxzL2FtcC8?oc=5&hl=en-US&gl=US&ceid=US:en,"{'href': 'https://whyy.org', 'title': 'WHYY'}",3
80,Opinion | George Washington University students protest for Palestinian peace - The Washington Post,Opinion | George Washington University students protest for Palestinian peace  The Washington Post,"Mon, 29 Apr 2024 07:00:00 GMT",https://news.google.com/rss/articles/CBMiUGh0dHBzOi8vd3d3Lndhc2hpbmd0b25wb3N0LmNvbS9vcGluaW9ucy8yMDI0LzA0LzI5L2d3LWNhbXB1cy1wcm90ZXN0cy1wYWxlc3RpbmUv0gEA?oc=5&hl=en-US&gl=US&ceid=US:en,"{'href': 'https://www.washingtonpost.com', 'title': 'The Washington Post'}",3
81,Student journalists discuss covering the campus protests - PBS NewsHour,Student journalists discuss covering the campus protests  PBS NewsHour,"Wed, 01 May 2024 07:00:00 GMT",https://news.google.com/rss/articles/CBMiemh0dHBzOi8vd3d3LnBicy5vcmcvbmV3c2hvdXIvY2xhc3Nyb29tL2RhaWx5LW5ld3MtbGVzc29ucy8yMDI0LzA1L3N0dWRlbnQtam91cm5hbGlzdHMtZGlzY3Vzcy1jb3ZlcmluZy10aGUtY2FtcHVzLXByb3Rlc3Rz0gEA?oc=5&hl=en-US&gl=US&ceid=US:en,"{'href': 'https://www.pbs.org', 'title': 'PBS NewsHour'}",3
82,Principles for Universities Responding to Campus Protests Over Gaza - Center For American Progress,Principles for Universities Responding to Campus Protests Over Gaza  Center For American Progress,"Wed, 01 May 2024 07:00:00 GMT",https://news.google.com/rss/articles/CBMibWh0dHBzOi8vd3d3LmFtZXJpY2FucHJvZ3Jlc3Mub3JnL2FydGljbGUvcHJpbmNpcGxlcy1mb3ItdW5pdmVyc2l0aWVzLXJlc3BvbmRpbmctdG8tY2FtcHVzLXByb3Rlc3RzLW92ZXItZ2F6YS_SAQA?oc=5&hl=en-US&gl=US&ceid=US:en,"{'href': 'https://www.americanprogress.org', 'title': 'Center For American Progress'}",3
83,"Why are students protesting? TN, US campuses see pro-Palestine sit ins - Tennessean","Why are students protesting? TN, US campuses see pro-Palestine sit ins  Tennessean","Thu, 02 May 2024 07:00:00 GMT",https://news.google.com/rss/articles/CBMikQFodHRwczovL3d3dy50ZW5uZXNzZWFuLmNvbS9zdG9yeS9uZXdzL2xvY2FsLzIwMjQvMDUvMDMvd2h5LWFyZS1zdHVkZW50cy1wcm90ZXN0aW5nLXVuaXZlcnNpdHktb2YtdGVubmVzc2VlLXZhbmRlcmJpbHQtZGVtb25zdHJhdGlvbnMvNzM1NTU2MzQwMDcv0gEA?oc=5&hl=en-US&gl=US&ceid=US:en,"{'href': 'https://www.tennessean.com', 'title': 'Tennessean'}",3
85,How Columbia became the force behind pro-Palestinian protests - The Associated Press,How Columbia became the force behind pro-Palestinian protests  The Associated Press,"Wed, 01 May 2024 07:00:00 GMT",https://news.google.com/rss/articles/CBMiZ2h0dHBzOi8vYXBuZXdzLmNvbS9hcnRpY2xlL2lzcmFlbC1wYWxlc3Rpbmlhbi1jYW1wdXMtcHJvdGVzdHMtdGltZWxpbmUtZjdjZDNhYmU2MzVmOGFmYTQ1MzJiN2JlZDkyMTJiNTbSAQA?oc=5&hl=en-US&gl=US&ceid=US:en,"{'href': 'https://apnews.com', 'title': 'The Associated Press'}",3
86,"Student protesters at UVM, Middlebury College meet with administrators - WCAX","Student protesters at UVM, Middlebury College meet with administrators  WCAX","Wed, 01 May 2024 07:00:00 GMT",https://news.google.com/rss/articles/CBMiY2h0dHBzOi8vd3d3LndjYXguY29tLzIwMjQvMDUvMDEvc3R1ZGVudC1wcm90ZXN0ZXJzLXV2bS1taWRkbGVidXJ5LWNvbGxlZ2UtbWVldC13aXRoLWFkbWluaXN0cmF0b3JzL9IBcmh0dHBzOi8vd3d3LndjYXguY29tLzIwMjQvMDUvMDEvc3R1ZGVudC1wcm90ZXN0ZXJzLXV2bS1taWRkbGVidXJ5LWNvbGxlZ2UtbWVldC13aXRoLWFkbWluaXN0cmF0b3JzLz9vdXRwdXRUeXBlPWFtcA?oc=5&hl=en-US&gl=US&ceid=US:en,"{'href': 'https://www.wcax.com', 'title': 'WCAX'}",3
87,US student protests: University leaders must listen and protect freedom of expression - ARTICLE 19 - ARTICLE 19,US student protests: University leaders must listen and protect freedom of expression - ARTICLE 19  ARTICLE 19,"Mon, 29 Apr 2024 07:00:00 GMT",https://news.google.com/rss/articles/CBMibmh0dHBzOi8vd3d3LmFydGljbGUxOS5vcmcvcmVzb3VyY2VzL3VzLXN0dWRlbnQtcHJvdGVzdHMtdW5pdmVyc2l0eS1sZWFkZXJzLW11c3QtcHJvdGVjdC1mcmVlZG9tLW9mLWV4cHJlc3Npb24v0gEA?oc=5&hl=en-US&gl=US&ceid=US:en,"{'href': 'https://www.article19.org', 'title': 'ARTICLE 19'}",3
88,Student protests on CT campuses: A focus on 'steadfastness' - The Connecticut Mirror,Student protests on CT campuses: A focus on 'steadfastness'  The Connecticut Mirror,"Sun, 05 May 2024 07:00:00 GMT",https://news.google.com/rss/articles/CBMiWWh0dHBzOi8vY3RtaXJyb3Iub3JnLzIwMjQvMDUvMDUvc3R1ZGVudC1wcm90ZXN0cy1vbi1jdC1jYW1wdXNlcy1hLWZvY3VzLW9uLXN0ZWFkZmFzdG5lc3Mv0gEA?oc=5&hl=en-US&gl=US&ceid=US:en,"{'href': 'https://ctmirror.org', 'title': 'The Connecticut Mirror'}",3
89,The Grit and Resilience of Student Protesters - The Nation,The Grit and Resilience of Student Protesters  The Nation,"Tue, 30 Apr 2024 07:00:00 GMT",https://news.google.com/rss/articles/CBMiT2h0dHBzOi8vd3d3LnRoZW5hdGlvbi5jb20vYXJ0aWNsZS9hY3RpdmlzbS9zdHVkZW50LXByb3Rlc3RlcnMtZ2VuLXotcmVzaWxpZW5jZS_SAVVodHRwczovL3d3dy50aGVuYXRpb24uY29tL2FydGljbGUvYWN0aXZpc20vc3R1ZGVudC1wcm90ZXN0ZXJzLWdlbi16LXJlc2lsaWVuY2UvdG5hbXAv?oc=5&hl=en-US&gl=US&ceid=US:en,"{'href': 'https://www.thenation.com', 'title': 'The Nation'}",3
90,"Campus Gaza protests: Here’s what’s happening in Philly, N.J. and Delaware - WHYY","Campus Gaza protests: Here’s what’s happening in Philly, N.J. and Delaware  WHYY","Fri, 03 May 2024 07:00:00 GMT",https://news.google.com/rss/articles/CBMiUmh0dHBzOi8vd2h5eS5vcmcvYXJ0aWNsZXMvcGEtbmotZGVsYXdhcmUtY29sbGVnZS1jYW1wdXMtcHJvdGVzdHMtaXNyYWVsLWhhbWFzLXdhci_SAVZodHRwczovL3doeXkub3JnL2FydGljbGVzL3BhLW5qLWRlbGF3YXJlLWNvbGxlZ2UtY2FtcHVzLXByb3Rlc3RzLWlzcmFlbC1oYW1hcy13YXIvYW1wLw?oc=5&hl=en-US&gl=US&ceid=US:en,"{'href': 'https://whyy.org', 'title': 'WHYY'}",3
91,University of Alabama students gather to protest in solidarity with Palestine - WVTM13 Birmingham,University of Alabama students gather to protest in solidarity with Palestine  WVTM13 Birmingham,"Wed, 01 May 2024 07:00:00 GMT",https://news.google.com/rss/articles/CBMiYWh0dHBzOi8vd3d3Lnd2dG0xMy5jb20vYXJ0aWNsZS91bml2ZXJzaXR5LWFsYWJhbWEtc3R1ZGVudHMtcHJvdGVzdC1wYWxlc3RpbmUtaXNyYWVsLWdhemEvNjA2NjMxOTnSAQA?oc=5&hl=en-US&gl=US&ceid=US:en,"{'href': 'https://www.wvtm13.com', 'title': 'WVTM13 Birmingham'}",3
92,College campus protests: Police make arrests at NYU and The New School - NBC News,College campus protests: Police make arrests at NYU and The New School  NBC News,"Fri, 03 May 2024 07:00:00 GMT",https://news.google.com/rss/articles/CBMidWh0dHBzOi8vd3d3Lm5iY25ld3MuY29tL25ld3MvdXMtbmV3cy9saXZlLWJsb2cvY2FtcHVzLXByb3Rlc3RzLWxpdmUtdXBkYXRlcy1wb3J0bGFuZC1zdGF0ZS1saWJyYXJ5LWNsZWFyZWQtcmNuYTE1MDUzNtIBNWh0dHBzOi8vd3d3Lm5iY25ld3MuY29tL25ld3MvYW1wL2xpdmUtYmxvZy9yY25hMTUwNTM2?oc=5&hl=en-US&gl=US&ceid=US:en,"{'href': 'https://www.nbcnews.com', 'title': 'NBC News'}",3
94,‘Divest from Israel’: Decoding the Gaza protest call shaking US campuses - Al Jazeera English,‘Divest from Israel’: Decoding the Gaza protest call shaking US campuses  Al Jazeera English,"Tue, 30 Apr 2024 07:00:00 GMT",https://news.google.com/rss/articles/CBMia2h0dHBzOi8vd3d3LmFsamF6ZWVyYS5jb20vbmV3cy8yMDI0LzQvMzAvZGl2ZXN0LWZyb20taXNyYWVsLWJyZWFraW5nLWRvd24tdGhlLXVzLXN0dWRlbnQtcHJvdGVzdGVycy1kZW1hbmRz0gFvaHR0cHM6Ly93d3cuYWxqYXplZXJhLmNvbS9hbXAvbmV3cy8yMDI0LzQvMzAvZGl2ZXN0LWZyb20taXNyYWVsLWJyZWFraW5nLWRvd24tdGhlLXVzLXN0dWRlbnQtcHJvdGVzdGVycy1kZW1hbmRz?oc=5&hl=en-US&gl=US&ceid=US:en,"{'href': 'https://www.aljazeera.com', 'title': 'Al Jazeera English'}",3
96,What are the rules governing protests on American campuses? - The Economist,What are the rules governing protests on American campuses?  The Economist,"Tue, 30 Apr 2024 07:00:00 GMT",https://news.google.com/rss/articles/CBMidmh0dHBzOi8vd3d3LmVjb25vbWlzdC5jb20vdGhlLWVjb25vbWlzdC1leHBsYWlucy8yMDI0LzA0LzMwL3doYXQtYXJlLXRoZS1ydWxlcy1nb3Zlcm5pbmctcHJvdGVzdHMtb24tYW1lcmljYW4tY2FtcHVzZXPSAQA?oc=5&hl=en-US&gl=US&ceid=US:en,"{'href': 'https://www.economist.com', 'title': 'The Economist'}",3
98,Columbia University faculty ‘horrified’ by mass arrests of student protesters - The Guardian,Columbia University faculty ‘horrified’ by mass arrests of student protesters  The Guardian,"Wed, 01 May 2024 07:00:00 GMT",https://news.google.com/rss/articles/CBMibGh0dHBzOi8vd3d3LnRoZWd1YXJkaWFuLmNvbS93b3JsZC8yMDI0L21heS8wMS9jb2x1bWJpYS11bml2ZXJzaXR5LXN0dWRlbnQtcHJvdGVzdGVycy1hcnJlc3RlZC1mYWN1bHR5LXJlYWN0c9IBbGh0dHBzOi8vYW1wLnRoZWd1YXJkaWFuLmNvbS93b3JsZC8yMDI0L21heS8wMS9jb2x1bWJpYS11bml2ZXJzaXR5LXN0dWRlbnQtcHJvdGVzdGVycy1hcnJlc3RlZC1mYWN1bHR5LXJlYWN0cw?oc=5&hl=en-US&gl=US&ceid=US:en,"{'href': 'https://www.theguardian.com', 'title': 'The Guardian'}",3
0,Scenes of Protests at College Campuses - The New York Times,Scenes of Protests at College Campuses  The New York Times,"Mon, 06 May 2024 07:00:00 GMT",https://news.google.com/rss/articles/CBMiU2h0dHBzOi8vd3d3Lm55dGltZXMuY29tLzIwMjQvMDQvMzAvdXMvY2FtcHVzLXByb3Rlc3RzLWNvbGxlZ2VzLWNvbHVtYmlhLXBob3Rvcy5odG1s0gEA?oc=5&hl=en-US&gl=US&ceid=US:en,"{'href': 'https://www.nytimes.com', 'title': 'The New York Times'}",3
1,"American Student Protest Movements, Then and Now - Arab Center Washington DC","American Student Protest Movements, Then and Now  Arab Center Washington DC","Fri, 10 May 2024 07:00:00 GMT",https://news.google.com/rss/articles/CBMiUmh0dHBzOi8vYXJhYmNlbnRlcmRjLm9yZy9yZXNvdXJjZS9hbWVyaWNhbi1zdHVkZW50LXByb3Rlc3QtbW92ZW1lbnRzLXRoZW4tYW5kLW5vdy_SAQA?oc=5&hl=en-US&gl=US&ceid=US:en,"{'href': 'https://arabcenterdc.org', 'title': 'Arab Center Washington DC'}",3
3,"Opinion | Pro-Palestinian student protesters repeat 1960s mistakes, help Trump - The Washington Post","Opinion | Pro-Palestinian student protesters repeat 1960s mistakes, help Trump  The Washington Post","Mon, 06 May 2024 07:00:00 GMT",https://news.google.com/rss/articles/CBMiXWh0dHBzOi8vd3d3Lndhc2hpbmd0b25wb3N0LmNvbS9vcGluaW9ucy8yMDI0LzA1LzA2L3N0dWRlbnQtcHJvdGVzdHMtbWlzdGFrZXMtZ2F6YS1oZWxwLXRydW1wL9IBAA?oc=5&hl=en-US&gl=US&ceid=US:en,"{'href': 'https://www.washingtonpost.com', 'title': 'The Washington Post'}",3
5,"Student protests over Gaza continue at UO, Willamette University - Oregon Public Broadcasting","Student protests over Gaza continue at UO, Willamette University  Oregon Public Broadcasting","Mon, 06 May 2024 07:00:00 GMT",https://news.google.com/rss/articles/CBMicWh0dHBzOi8vd3d3Lm9wYi5vcmcvYXJ0aWNsZS8yMDI0LzA1LzA2L3N0dWRlbnQtcHJvdGVzdHMtZ2F6YS1jb250aW51ZS11bml2ZXJzaXR5LW9mLW9yZWdvbi13aWxsYW1ldHRlLXVuaXZlcnNpdHkv0gGAAWh0dHBzOi8vd3d3Lm9wYi5vcmcvYXJ0aWNsZS8yMDI0LzA1LzA2L3N0dWRlbnQtcHJvdGVzdHMtZ2F6YS1jb250aW51ZS11bml2ZXJzaXR5LW9mLW9yZWdvbi13aWxsYW1ldHRlLXVuaXZlcnNpdHkvP291dHB1dFR5cGU9YW1w?oc=5&hl=en-US&gl=US&ceid=US:en,"{'href': 'https://www.opb.org', 'title': 'Oregon Public Broadcasting'}",3
6,"Protesters reclaim encampment at MIT, as university threatens suspension - WBUR News","Protesters reclaim encampment at MIT, as university threatens suspension  WBUR News","Tue, 07 May 2024 07:00:00 GMT",https://news.google.com/rss/articles/CBMiVGh0dHBzOi8vd3d3LndidXIub3JnL25ld3MvMjAyNC8wNS8wNi9taXQtaGFydmFyZC1wcm90ZXN0ZXJzLXN0dWRlbnRzLXN1c3BlbnNpb24tZ2F6YdIBAA?oc=5&hl=en-US&gl=US&ceid=US:en,"{'href': 'https://www.wbur.org', 'title': 'WBUR News'}",3
7,"Student protests, then and now | Opinion - The Philadelphia Inquirer","Student protests, then and now | Opinion  The Philadelphia Inquirer","Tue, 07 May 2024 07:00:00 GMT",https://news.google.com/rss/articles/CBMiaWh0dHBzOi8vd3d3LmlucXVpcmVyLmNvbS9vcGluaW9uL3N0dWRlbnQtcHJvdGVzdC1nYXphLWlzcmFlbC1mcmVlLXNwZWVjaC1qb25hdGhhbi16aW1tZXJtYW4tMjAyNDA1MDcuaHRtbNIBAA?oc=5&hl=en-US&gl=US&ceid=US:en,"{'href': 'https://www.inquirer.com', 'title': 'The Philadelphia Inquirer'}",3
8,'Protest Paradigm' Shows What's Wrong with Media Coverage of Student Activism - Scientific American,'Protest Paradigm' Shows What's Wrong with Media Coverage of Student Activism  Scientific American,"Tue, 07 May 2024 14:10:37 GMT",https://news.google.com/rss/articles/CBMidmh0dHBzOi8vd3d3LnNjaWVudGlmaWNhbWVyaWNhbi5jb20vYXJ0aWNsZS9wcm90ZXN0LXBhcmFkaWdtLXNob3dzLXdoYXRzLXdyb25nLXdpdGgtbWVkaWEtY292ZXJhZ2Utb2Ytc3R1ZGVudC1hY3RpdmlzbS_SAQA?oc=5&hl=en-US&gl=US&ceid=US:en,"{'href': 'https://www.scientificamerican.com', 'title': 'Scientific American'}",3
10,Where Pro-Palestinian college protesters have been arrested - Axios,Where Pro-Palestinian college protesters have been arrested  Axios,"Fri, 10 May 2024 07:00:00 GMT",https://news.google.com/rss/articles/CBMiTmh0dHBzOi8vd3d3LmF4aW9zLmNvbS8yMDI0LzA0LzI3L3BhbGVzdGluaWFuLWNvbGxlZ2UtcHJvdGVzdC1hcnJlc3QtZW5jYW1wbWVudNIBAA?oc=5&hl=en-US&gl=US&ceid=US:en,"{'href': 'https://www.axios.com', 'title': 'Axios'}",3
11,How college faculty are supporting student protesters — and what they're risking - The 19th*,How college faculty are supporting student protesters — and what they're risking  The 19th*,"Wed, 08 May 2024 07:00:00 GMT",https://news.google.com/rss/articles/CBMiVWh0dHBzOi8vMTl0aG5ld3Mub3JnLzIwMjQvMDUvY2FtcHVzLXByb3Rlc3RzLWhvdy1mYWN1bHR5LXByb2Zlc3NvcnMtc3VwcG9ydC1zdHVkZW50cy_SAQA?oc=5&hl=en-US&gl=US&ceid=US:en,"{'href': 'https://19thnews.org', 'title': 'The 19th*'}",3
12,Campus protests in Europe: Police break up pro-Palestinian camp at Amsterdam university - The Associated Press,Campus protests in Europe: Police break up pro-Palestinian camp at Amsterdam university  The Associated Press,"Tue, 07 May 2024 07:00:00 GMT",https://news.google.com/rss/articles/CBMidGh0dHBzOi8vYXBuZXdzLmNvbS9hcnRpY2xlL2Ftc3RlcmRhbS1jYW1wdXMtcHJvdGVzdC1nYXphLWV1cm9wZS1wYWxlc3RpbmlhbnMtaXNyYWVsLTFlZWI0ZTA3MjMxZWJjYzY3NzYzMTlmZjA2NjNkYjY20gEA?oc=5&hl=en-US&gl=US&ceid=US:en,"{'href': 'https://apnews.com', 'title': 'The Associated Press'}",3
13,Student Protests and the Old Gods - Public Discourse,Student Protests and the Old Gods  Public Discourse,"Tue, 07 May 2024 00:00:21 GMT",https://news.google.com/rss/articles/CBMiMWh0dHBzOi8vd3d3LnRoZXB1YmxpY2Rpc2NvdXJzZS5jb20vMjAyNC8wNS85NDg1My_SAQA?oc=5&hl=en-US&gl=US&ceid=US:en,"{'href': 'https://www.thepublicdiscourse.com', 'title': 'Public Discourse'}",3
14,Pro-Palestinian protest in Amsterdam turns violent after student rally halted - Reuters,Pro-Palestinian protest in Amsterdam turns violent after student rally halted  Reuters,"Tue, 07 May 2024 07:00:00 GMT",https://news.google.com/rss/articles/CBMidGh0dHBzOi8vd3d3LnJldXRlcnMuY29tL3dvcmxkL2V1cm9wZS9kdXRjaC1wb2xpY2UtZW5kLXByby1wYWxlc3Rpbmlhbi1kZW1vbnN0cmF0aW9uLWFtc3RlcmRhbS11bml2ZXJzaXR5LTIwMjQtMDUtMDcv0gEA?oc=5&hl=en-US&gl=US&ceid=US:en,"{'href': 'https://www.reuters.com', 'title': 'Reuters'}",3
16,"After student protest at U of A, Alabama Senators support new legislation - Alabama Political Reporter","After student protest at U of A, Alabama Senators support new legislation  Alabama Political Reporter","Tue, 07 May 2024 07:00:00 GMT",https://news.google.com/rss/articles/CBMifmh0dHBzOi8vd3d3LmFscmVwb3J0ZXIuY29tLzIwMjQvMDUvMDcvYWZ0ZXItc3R1ZGVudC1wcm90ZXN0LWF0LXVuaXZlcnNpdHktb2YtYWxhYmFtYS1hbGFiYW1hLXNlbmF0b3JzLXN1cHBvcnQtbmV3LWxlZ2lzbGF0aW9uL9IBAA?oc=5&hl=en-US&gl=US&ceid=US:en,"{'href': 'https://www.alreporter.com', 'title': 'Alabama Political Reporter'}",3
17,Opinion | Why the Campus Protests Are So Troubling - The New York Times,Opinion | Why the Campus Protests Are So Troubling  The New York Times,"Wed, 08 May 2024 07:00:00 GMT",https://news.google.com/rss/articles/CBMiRGh0dHBzOi8vd3d3Lm55dGltZXMuY29tLzIwMjQvMDUvMDgvb3Bpbmlvbi9jYW1wdXMtcHJvdGVzdHMtZ2F6YS5odG1s0gEA?oc=5&hl=en-US&gl=US&ceid=US:en,"{'href': 'https://www.nytimes.com', 'title': 'The New York Times'}",3
18,Organizing massive campus protests required logistical savvy. Here's how students pulled it off. - ABC News,Organizing massive campus protests required logistical savvy. Here's how students pulled it off.  ABC News,"Sat, 11 May 2024 07:00:00 GMT",https://news.google.com/rss/articles/CBMicmh0dHBzOi8vYWJjbmV3cy5nby5jb20vVVMvb3JnYW5pemluZy1tYXNzaXZlLWNhbXB1cy1wcm90ZXN0cy1yZXF1aXJlZC1sb2dpc3RpY2FsLXNhdnZ5LXN0dWRlbnRzL3N0b3J5P2lkPTExMDAyMTc3NdIBdmh0dHBzOi8vYWJjbmV3cy5nby5jb20vYW1wL1VTL29yZ2FuaXppbmctbWFzc2l2ZS1jYW1wdXMtcHJvdGVzdHMtcmVxdWlyZWQtbG9naXN0aWNhbC1zYXZ2eS1zdHVkZW50cy9zdG9yeT9pZD0xMTAwMjE3NzU?oc=5&hl=en-US&gl=US&ceid=US:en,"{'href': 'https://abcnews.go.com', 'title': 'ABC News'}",3
19,Pro-Palestinian protesters reach agreements with some colleges - NPR,Pro-Palestinian protesters reach agreements with some colleges  NPR,"Tue, 07 May 2024 07:00:00 GMT",https://news.google.com/rss/articles/CBMiUWh0dHBzOi8vd3d3Lm5wci5vcmcvMjAyNC8wNS8wNy8xMjQ5MzY4MTUxL2dhemEtY29sbGVnZS1wcm90ZXN0LWRlYWwtYnJvd24tcnV0Z2Vyc9IBAA?oc=5&hl=en-US&gl=US&ceid=US:en,"{'href': 'https://www.npr.org', 'title': 'NPR'}",3
20,Amsterdam pro-Palestinian student protest broken up by police - Reuters,Amsterdam pro-Palestinian student protest broken up by police  Reuters,"Wed, 08 May 2024 07:00:00 GMT",https://news.google.com/rss/articles/CBMifWh0dHBzOi8vd3d3LnJldXRlcnMuY29tL3dvcmxkL2V1cm9wZS9wcm8tcGFsZXN0aW5pYW4tcHJvdGVzdGVycy1vY2N1cHktYW1zdGVyZGFtLXVuaXZlcnNpdHktb3Zlcm5pZ2h0LWxvY2FsLW1lZGlhLTIwMjQtMDUtMDgv0gEA?oc=5&hl=en-US&gl=US&ceid=US:en,"{'href': 'https://www.reuters.com', 'title': 'Reuters'}",3
21,"At U.C. Berkeley Ceremony, a Student Protest Draws in Hundreds - The New York Times","At U.C. Berkeley Ceremony, a Student Protest Draws in Hundreds  The New York Times","Sat, 11 May 2024 07:00:00 GMT",https://news.google.com/rss/articles/CBMiSWh0dHBzOi8vd3d3Lm55dGltZXMuY29tLzIwMjQvMDUvMTEvdXMvdWMtYmVya2VsZXktcHJvdGVzdC1ncmFkdWF0aW9uLmh0bWzSAQA?oc=5&hl=en-US&gl=US&ceid=US:en,"{'href': 'https://www.nytimes.com', 'title': 'The New York Times'}",3
22,Texas students push for schools to divest from Israel - The Texas Tribune,Texas students push for schools to divest from Israel  The Texas Tribune,"Wed, 08 May 2024 07:00:00 GMT",https://news.google.com/rss/articles/CBMiVWh0dHBzOi8vd3d3LnRleGFzdHJpYnVuZS5vcmcvMjAyNC8wNS8wOC91dC1hdXN0aW4tdGV4YXMtYW0tcHJvdGVzdC1kaXZlc3RtZW50LWlzcmFlbC_SAQA?oc=5&hl=en-US&gl=US&ceid=US:en,"{'href': 'https://www.texastribune.org', 'title': 'The Texas Tribune'}",3
23,"In the 1980s, he led student protests. Now, he's a college dean - NPR","In the 1980s, he led student protests. Now, he's a college dean  NPR","Sun, 05 May 2024 07:00:00 GMT",https://news.google.com/rss/articles/CBMiUWh0dHBzOi8vd3d3Lm5wci5vcmcvMjAyNC8wNS8wNS8xMjQ5MTM0OTM0L2dhemEtcHJvdGVzdHMtdWMtYmVya2VsZXktcGVkcm8tbm9ndWVyYdIBAA?oc=5&hl=en-US&gl=US&ceid=US:en,"{'href': 'https://www.npr.org', 'title': 'NPR'}",3
24,Pro-Palestine protests: How some universities reached deals with students - Al Jazeera English,Pro-Palestine protests: How some universities reached deals with students  Al Jazeera English,"Tue, 07 May 2024 07:00:00 GMT",https://news.google.com/rss/articles/CBMicGh0dHBzOi8vd3d3LmFsamF6ZWVyYS5jb20vbmV3cy8yMDI0LzUvNy9wcm8tcGFsZXN0aW5lLXByb3Rlc3RzLWhvdy1zb21lLXVuaXZlcnNpdGllcy1yZWFjaGVkLWRlYWxzLXdpdGgtc3R1ZGVudHPSAXRodHRwczovL3d3dy5hbGphemVlcmEuY29tL2FtcC9uZXdzLzIwMjQvNS83L3Byby1wYWxlc3RpbmUtcHJvdGVzdHMtaG93LXNvbWUtdW5pdmVyc2l0aWVzLXJlYWNoZWQtZGVhbHMtd2l0aC1zdHVkZW50cw?oc=5&hl=en-US&gl=US&ceid=US:en,"{'href': 'https://www.aljazeera.com', 'title': 'Al Jazeera English'}",3
26,College protests: Students protesting at USC leave after being surrounded by police - The Associated Press,College protests: Students protesting at USC leave after being surrounded by police  The Associated Press,"Sun, 05 May 2024 07:00:00 GMT",https://news.google.com/rss/articles/CBMicmh0dHBzOi8vYXBuZXdzLmNvbS9hcnRpY2xlL2lzcmFlbC1wYWxlc3RpbmUtZ2F6YS13YXItdW5pdmVyc2l0aWVzLWNhbXB1cy1wcm90ZXN0cy0zYWZhZmMyZDU2YzZkYzg3NjM1NTQ5NDc1ZDk0ZTFkNtIBAA?oc=5&hl=en-US&gl=US&ceid=US:en,"{'href': 'https://apnews.com', 'title': 'The Associated Press'}",3
27,US police break up Gaza protest encampment at George Washington University - Al Jazeera English,US police break up Gaza protest encampment at George Washington University  Al Jazeera English,"Wed, 08 May 2024 07:00:00 GMT",https://news.google.com/rss/articles/CBMicmh0dHBzOi8vd3d3LmFsamF6ZWVyYS5jb20vbmV3cy8yMDI0LzUvOC91cy1wb2xpY2UtYnJlYWstdXAtZ2F6YS1wcm90ZXN0LWVuY2FtcG1lbnQtYXQtZ2VvcmdlLXdhc2hpbmd0b24tdW5pdmVyc2l0edIBdmh0dHBzOi8vd3d3LmFsamF6ZWVyYS5jb20vYW1wL25ld3MvMjAyNC81LzgvdXMtcG9saWNlLWJyZWFrLXVwLWdhemEtcHJvdGVzdC1lbmNhbXBtZW50LWF0LWdlb3JnZS13YXNoaW5ndG9uLXVuaXZlcnNpdHk?oc=5&hl=en-US&gl=US&ceid=US:en,"{'href': 'https://www.aljazeera.com', 'title': 'Al Jazeera English'}",3
28,Student Protesters Are Right to Be Wary of Bad-Faith Journalists - Jacobin magazine,Student Protesters Are Right to Be Wary of Bad-Faith Journalists  Jacobin magazine,"Tue, 07 May 2024 07:00:00 GMT",https://news.google.com/rss/articles/CBMiSGh0dHBzOi8vamFjb2Jpbi5jb20vMjAyNC8wNS9zdHVkZW50LXByb3Rlc3RlcnMtbWFpbnN0cmVhbS1tZWRpYS1jb3ZlcmFnZdIBAA?oc=5&hl=en-US&gl=US&ceid=US:en,"{'href': 'https://jacobin.com', 'title': 'Jacobin magazine'}",3
29,University of Mississippi investigates student over Palestine counter-protest - The Guardian US,University of Mississippi investigates student over Palestine counter-protest  The Guardian US,"Mon, 06 May 2024 07:00:00 GMT",https://news.google.com/rss/articles/CBMieWh0dHBzOi8vd3d3LnRoZWd1YXJkaWFuLmNvbS91cy1uZXdzL2FydGljbGUvMjAyNC9tYXkvMDYvdW5pdmVyc2l0eS1vZi1taXNzaXNzaXBwaS1wYWxlc3RpbmUtY291bnRlci1wcm90ZXN0LWludmVzdGlnYXRpb27SAXlodHRwczovL2FtcC50aGVndWFyZGlhbi5jb20vdXMtbmV3cy9hcnRpY2xlLzIwMjQvbWF5LzA2L3VuaXZlcnNpdHktb2YtbWlzc2lzc2lwcGktcGFsZXN0aW5lLWNvdW50ZXItcHJvdGVzdC1pbnZlc3RpZ2F0aW9u?oc=5&hl=en-US&gl=US&ceid=US:en,"{'href': 'https://www.theguardian.com', 'title': 'The Guardian US'}",3
30,Teaching and Learning About the Pro-Palestinian Student Protests on College Campuses - The New York Times,Teaching and Learning About the Pro-Palestinian Student Protests on College Campuses  The New York Times,"Thu, 09 May 2024 07:00:00 GMT",https://news.google.com/rss/articles/CBMikgFodHRwczovL3d3dy5ueXRpbWVzLmNvbS8yMDI0LzA1LzA5L2xlYXJuaW5nL2xlc3Nvbi1wbGFucy90ZWFjaGluZy1hbmQtbGVhcm5pbmctYWJvdXQtdGhlLXByby1wYWxlc3Rpbmlhbi1zdHVkZW50LXByb3Rlc3RzLW9uLWNvbGxlZ2UtY2FtcHVzZXMuaHRtbNIBAA?oc=5&hl=en-US&gl=US&ceid=US:en,"{'href': 'https://www.nytimes.com', 'title': 'The New York Times'}",3
31,Columbia University cancels commencement ceremony following student protests - The Guardian US,Columbia University cancels commencement ceremony following student protests  The Guardian US,"Mon, 06 May 2024 07:00:00 GMT",https://news.google.com/rss/articles/CBMiYGh0dHBzOi8vd3d3LnRoZWd1YXJkaWFuLmNvbS91cy1uZXdzL2FydGljbGUvMjAyNC9tYXkvMDYvY29sdW1iaWEtcHJvdGVzdHMtY29tbWVuY2VtZW50LWNhbmNlbGxlZNIBYGh0dHBzOi8vYW1wLnRoZWd1YXJkaWFuLmNvbS91cy1uZXdzL2FydGljbGUvMjAyNC9tYXkvMDYvY29sdW1iaWEtcHJvdGVzdHMtY29tbWVuY2VtZW50LWNhbmNlbGxlZA?oc=5&hl=en-US&gl=US&ceid=US:en,"{'href': 'https://www.theguardian.com', 'title': 'The Guardian US'}",3
32,UN expert raises alarm over unfair treatment of pro-Palestinian student protesters in US - UN News,UN expert raises alarm over unfair treatment of pro-Palestinian student protesters in US  UN News,"Fri, 10 May 2024 07:00:00 GMT",https://news.google.com/rss/articles/CBMiLGh0dHBzOi8vbmV3cy51bi5vcmcvZW4vc3RvcnkvMjAyNC8wNS8xMTQ5NjE20gEA?oc=5&hl=en-US&gl=US&ceid=US:en,"{'href': 'https://news.un.org', 'title': 'UN News'}",3
34,University of Rochester to suspend student protesters - WXXI News,University of Rochester to suspend student protesters  WXXI News,"Thu, 09 May 2024 07:00:00 GMT",https://news.google.com/rss/articles/CBMiZGh0dHBzOi8vd3d3Lnd4eGluZXdzLm9yZy9sb2NhbC1uZXdzLzIwMjQtMDUtMDkvdW5pdmVyc2l0eS1vZi1yb2NoZXN0ZXItdG8tc3VzcGVuZC1zdHVkZW50LXByb3Rlc3RlcnPSAQA?oc=5&hl=en-US&gl=US&ceid=US:en,"{'href': 'https://www.wxxinews.org', 'title': 'WXXI News'}",3
35,Where is the pro-Palestine student protest movement heading? - Al Jazeera English,Where is the pro-Palestine student protest movement heading?  Al Jazeera English,"Sun, 05 May 2024 07:00:00 GMT",https://news.google.com/rss/articles/CBMidmh0dHBzOi8vd3d3LmFsamF6ZWVyYS5jb20vcHJvZ3JhbS90aGUtYm90dG9tLWxpbmUvMjAyNC81LzUvd2hlcmUtaXMtdGhlLXByby1wYWxlc3RpbmUtc3R1ZGVudC1wcm90ZXN0LW1vdmVtZW50LWhlYWRpbmfSAXpodHRwczovL3d3dy5hbGphemVlcmEuY29tL2FtcC9wcm9ncmFtL3RoZS1ib3R0b20tbGluZS8yMDI0LzUvNS93aGVyZS1pcy10aGUtcHJvLXBhbGVzdGluZS1zdHVkZW50LXByb3Rlc3QtbW92ZW1lbnQtaGVhZGluZw?oc=5&hl=en-US&gl=US&ceid=US:en,"{'href': 'https://www.aljazeera.com', 'title': 'Al Jazeera English'}",3
